{
  "$schema": "https://json-schema.org/draft/2020-12/schema",
  "$id": "https://registry.stancatti.dev/schemas/package-provenance.schema.json",
  "title": "Stancatti registry package provenance",
  "type": "object",
  "additionalProperties": false,
  "required": ["schemaVersion", "kind", "resourceId", "resourceSlug", "origin", "packagedAt", "license", "payload"],
  "properties": {
    "schemaVersion": { "const": "1.0.0" },
    "kind": { "const": "stancatti-registry-package" },
    "resourceId": { "$ref": "#/$defs/uuid" },
    "resourceSlug": { "$ref": "#/$defs/slug" },
    "origin": {
      "type": "object", "additionalProperties": false, "required": ["repositoryUrl", "refType", "refValue", "commitSha", "monitoredPath"],
      "properties": {
        "repositoryUrl": { "$ref": "#/$defs/httpsUrl" },
        "refType": { "enum": ["release", "tag", "commit"] },
        "refValue": { "type": "string", "minLength": 1, "maxLength": 300 },
        "commitSha": { "$ref": "#/$defs/commitSha" },
        "monitoredPath": { "type": "string", "pattern": "^(?:\\.|[A-Za-z0-9._-]+(?:/[A-Za-z0-9._-]+)*)$", "maxLength": 240 }
      }
    },
    "packagedAt": { "$ref": "#/$defs/timestamp" },
    "license": {
      "type": "object", "additionalProperties": false, "required": ["spdx", "includedFiles"],
      "properties": { "spdx": { "type": "string", "pattern": "^[A-Za-z0-9.+-]{1,40}$" }, "includedFiles": { "type": "array", "items": { "type": "string", "minLength": 1, "maxLength": 240 }, "minItems": 1, "uniqueItems": true } }
    },
    "payload": {
      "type": "object", "additionalProperties": false, "required": ["sha256", "fileCount", "uncompressedBytes"],
      "properties": { "sha256": { "$ref": "#/$defs/sha256" }, "fileCount": { "type": "integer", "minimum": 1, "maximum": 10000 }, "uncompressedBytes": { "type": "integer", "minimum": 1, "maximum": 209715200 } }
    }
  },
  "$defs": {
    "uuid": { "type": "string", "pattern": "^[0-9a-f]{8}-[0-9a-f]{4}-[1-5][0-9a-f]{3}-[89ab][0-9a-f]{3}-[0-9a-f]{12}$" },
    "slug": { "type": "string", "pattern": "^[a-z0-9]+(?:-[a-z0-9]+)*$", "minLength": 1, "maxLength": 80 },
    "sha256": { "type": "string", "pattern": "^[a-f0-9]{64}$" },
    "commitSha": { "type": "string", "pattern": "^[a-f0-9]{40}$" },
    "timestamp": { "type": "string", "pattern": "^\\d{4}-\\d{2}-\\d{2}T\\d{2}:\\d{2}:\\d{2}(?:\\.\\d{3})?Z$" },
    "httpsUrl": { "type": "string", "pattern": "^https://[^\\s]+$", "maxLength": 2048 }
  }
}
